{
  "schema_version": 1,
  "id": "phase17-predecessor-pressure",
  "status": "ACCEPTED",
  "claim_ids": ["P104", "P105", "P106", "E28", "E29", "NG29", "H104", "H105"],
  "objective": "Audit four-odd accelerated predecessor residues, strengthen the distinct finite-crossing split to 270, prove the exponent-code second-moment identity, and state an exact ceiling only for coefficient-only summed-Haar mechanisms.",
  "exact_scope": {
    "quantifiers": [
      "every positive exponent composition with one through four odd steps and total multiplier greater than one",
      "all CRT classes modulo 648 in the stated right-continuous upper envelope",
      "every positive source below 300000 under literal shortcut iteration",
      "all finite exponent words in the first-passage pressure theorem",
      "all concatenations through three blocks of the selected r=4 suffix-decodable code",
      "every mandatory adversarial family and the scope boundaries of NG19 and NG21 through NG28"
    ],
    "bounds": {"maximum_predecessor_odd_steps": 4, "direct_source_bound_exclusive": 300000, "suffix_code_odd_steps": 4, "suffix_code_audit_blocks": 3, "log_series_terms": 12},
    "completeness": "P104--P106 and NG29 are exact only under their written hypotheses and mechanism definition. E28 and E29 are exhaustive only in the recorded finite ranges."
  },
  "arithmetic": {"proof_decisions": "exact", "floating_point_role": "none in acceptance; approximate roots are reported only after exact rational brackets"},
  "commands": {
    "generator": [".venv/bin/python src/phase17_search.py --artifact-dir artifacts --direct-bound 300000"],
    "verifier": [".venv/bin/python verifier/verify_phase17.py --artifact-dir artifacts --write-report artifacts/phase17_verifier.json"],
    "tests": [".venv/bin/python -m pytest -q tests/test_phase17_properties.py tests/test_phase17_verifier.py tests/test_research_health.py", ".venv/bin/python -m pytest -q"]
  },
  "independence": {
    "verifier_reconstructs": ["all exponent compositions and explicit affine sums in a different order", "all mod-81 lifts and mod-648 CRT classes", "the direct source audit in descending order", "all exact logarithm and ceiling brackets", "the r=4 suffix code and concatenated endpoints"],
    "forbidden_imports": ["src.phase17_search", "phase17_search", "from src", "import src"],
    "tamper_tests": ["tests/test_phase17_verifier.py"]
  },
  "adversarial_families": ["2^m-1", "8^m-5", "(110|111)^*", "A=11101", "B=1100", "A^rB^s", "NG19", "NG21", "NG22", "NG23", "NG24", "NG25", "NG26", "NG27", "NG28"],
  "artifacts": ["artifacts/phase17_predecessor_sieve.json", "artifacts/phase17_direct_audit.json", "artifacts/phase17_pressure.json", "artifacts/phase17_suffix_code.json", "artifacts/phase17_adversarial.json", "artifacts/phase17_obstruction_report.md", "artifacts/phase17_verifier.json", "artifacts/SHA256SUMS"],
  "stop_conditions": ["Stop at the first mismatch in the mod-81 multiplier or mod-648 CRT tables.", "Reject the 270 constant if the exact log margin is not positive.", "Do not call the right-continuous upper envelope the exact allowed set at multiplier thresholds.", "Do not generalize the coefficient-only Haar ceiling to affine, transition-aware, or ordinary-source mechanisms.", "Do not infer asymptotic code-root convergence from the r=4 finite code.", "Enter the proof-claim emergency protocol before changing proves_collatz."],
  "interpretation_boundary": ["G270 and H270 remain unexcluded.", "The pressure identity is symbolic and its union bound has no lower measure implication when cylinders collide.", "The 360.469 ceiling is scoped to a deliberately information-discarding proof mechanism.", "The periodic branch, H89, H72, and Collatz remain open.", "proves_collatz remains false."],
  "recorded_result": {
    "commit": "f2ab1b4aa0fe957dd7d9ee0f4c81e51735682c1b",
    "generator": "completed at n<300000 in 1.90s",
    "verifier": "valid=true at n<300000 in 2.03s",
    "focused_tests": "15 passed in 7.13s",
    "full_tests": "268 passed in 335.16s",
    "strict_research_health": "valid=true with zero untracked artifacts",
    "manifest_sha256": "ea932e96e56ef2692de6879b411b0efa638c3cb0783ddbc20bd4722d8f1e8d1c",
    "verifier_valid": true
  },
  "proves_collatz": false
}
