{
  "schema_version": 1,
  "id": "phase37-internal-uniform-sparsity",
  "status": "RUNNING",
  "claim_ids": ["P219", "P220", "P221", "P222", "P223", "P224", "P225", "P226", "E53", "H70", "H72", "H133"],
  "objective": "Independently audit the elementary parity-vector recursion for location-uniform orbit sparsity and determine its exact consequences for nonperiodic permanent-safe tails, renewal boundaries, and noncritical cycles.",
  "exact_scope": {
    "quantifiers": [
      "every equal-time collision-free positive set and every translated integer interval",
      "every rho greater than H2(1/log2(3)), with an explicit theta=14/23 and rho=29/30 specialization",
      "every non-eventually-periodic positive integer shortcut orbit",
      "every renewal boundary of the resulting permanent-safe tail",
      "every primitive positive noncritical cycle"
    ],
    "bounds": {
      "explicit_induction_N0": 135,
      "explicit_constant": 32,
      "affine_word_length_maximum": 16,
      "translation_length_maximum": 12,
      "orbit_start_maximum": 4096,
      "orbit_step_limit": 512,
      "renewal_code_length_maximum": 16
    },
    "completeness": "P219-P226 are symbolic all-scale theorems under their stated positive/injectivity hypotheses; E53 is bounded convention evidence. H70, H72, H133, critical cycles, and Collatz remain open."
  },
  "arithmetic": {
    "proof_decisions": "exact",
    "exact_methods": "arbitrary-precision integer exponent comparisons, rational affine/product identities, exhaustive parity cylinders, translated intervals, and independent renewal-code reconstruction",
    "floating_point_role": "orientation-only decimal values may appear in prose; no acceptance decision uses floating point"
  },
  "commands": {
    "generator": [".venv/bin/python src/phase37_search.py --artifact-dir artifacts"],
    "verifier": [".venv/bin/python verifier/verify_phase37.py --artifact-dir artifacts --output artifacts/phase37_verifier.json"],
    "tests": [".venv/bin/python -m pytest -q tests/test_phase37_properties.py tests/test_phase37_verifier.py tests/test_research_health.py", ".venv/bin/python -m pytest -q", ".venv/bin/python scripts/research_health.py --strict"]
  },
  "independence": {
    "verifier_reconstructs": ["the exact rational induction boundary", "all affine/parity rows through N<=16 and translated checks through N<=12", "the finite orbit-product and renewal-code corpora", "all mandatory adversarial rows"],
    "forbidden_imports": ["src.phase37_search", "phase37_search", "from src", "import src"],
    "tamper_tests": ["tests/test_phase37_verifier.py"]
  },
  "adversarial_families": ["2^m-1", "8^m-5", "(110|111)^*", "A=11101", "B=1100", "A^rB^s", "source 167", "NG21-NG42", "trivial cycle and powers", "negative cycles", "rational shadows", "P206/P218 orientation split"],
  "artifacts": ["artifacts/phase37_theory.json", "artifacts/phase37_induction_certificate.json", "artifacts/phase37_affine_interval_audit.json", "artifacts/phase37_renewal_audit.json", "artifacts/phase37_regressions.json", "artifacts/phase37_obstruction_report.md", "artifacts/phase37_verifier.json", "artifacts/SHA256SUMS"],
  "stop_conditions": ["Do not infer address multiplicity control from one-orbit uniform sparsity.", "Do not apply the positive-set theorem to negative cycles or formal 2-adic sources.", "Do not mark H70 proved merely because its global role is bypassed.", "Enter the proof-claim emergency protocol before changing proves_collatz."],
  "interpretation_boundary": ["P222 internally removes the finite-crossing branch only for actual nonperiodic positive integer orbits.", "The density-one defect estimate is not pointwise.", "The noncritical cycle cutoff is effective in principle but not an exclusion of critical or arbitrary-area cycles.", "The Collatz conjecture remains open."],
  "proves_collatz": false
}
