{
  "schema_version": 1,
  "id": "substitution-arithmetic",
  "status": "RUNNING",
  "claim_ids": ["P285", "P286", "E66", "H112", "H72"],
  "objective": "Independently audit rational-source exclusion and exponential canonical residues for aperiodic binary uniform fixed words, without EXT08 or an orbit-coverage premise.",
  "exact_scope": {
    "quantifiers": ["Every aperiodic fixed word of a binary r-uniform substitution, r>=2", "Four explicit substitutions and eight source bounds each"],
    "bounds": {"auxiliary_x_degree": 10, "vanishing_conditions": 21, "source_bound_powers": [8,16,32,64,128,256,512,1024], "functional_equation_image_lengths": [2,3,4], "functional_equation_input_max": 5},
    "completeness": "Written universal proof and finite certificates are distinct. No claim that arbitrary nonperiodic Collatz words are substitution fixed words."
  },
  "arithmetic": {"proof_decisions": "exact", "floating_point_role": "Timing only."},
  "commands": {
    "generator": [".venv/bin/python -m src.substitution_arithmetic_search --artifact-dir artifacts"],
    "verifier": [".venv/bin/python verifier/verify_substitution_arithmetic.py --artifact-dir artifacts --output artifacts/substitution_arithmetic_verifier.json"],
    "tests": [".venv/bin/python -m pytest -q tests/test_substitution_arithmetic.py", ".venv/bin/python scripts/research_health.py --strict"]
  },
  "independence": {
    "verifier_reconstructs": ["Sparse polynomial identities versus fraction-free nullspace", "Base-r random access versus iterative substitution", "Parity carry lifting versus affine modular inverse", "Finite tower error and rational specialization"],
    "forbidden_imports": ["src", "substitution_arithmetic_search", "substitution_auxiliary", "sympy"],
    "tamper_tests": ["tests/test_substitution_arithmetic.py"]
  },
  "adversarial_families": ["2^m-1", "8^m-5", "(110|111)^*", "A=11101", "B=1100", "A^rB^s", "r=1 identity", "periodic 10 source 1", "all ones source -1", "all zeros source 0", "negative delta", "specialization zero", "NG45", "NG46", "NG51"],
  "artifacts": ["artifacts/substitution_arithmetic_auxiliaries.json", "artifacts/substitution_arithmetic_evidence.json", "artifacts/substitution_arithmetic_regressions.json", "artifacts/substitution_arithmetic_verifier.json", "artifacts/SHA256SUMS"],
  "stop_conditions": ["Reject a vanishing auxiliary evaluation or unaccounted valuation/height loss", "Do not promote finite examples or exclusion of a special language to Collatz exclusion"],
  "interpretation_boundary": ["No primitivity needed; binary uniform fixed words only", "H112/H72/H89/H133 and EXT08 remain OPEN", "Supplied code adapted; not independent authorship or proof-assistant formalization"],
  "proves_collatz": false
}
