{
  "schema_version": 1,
  "id": "phase16-critical-dichotomy",
  "status": "ACCEPTED",
  "claim_ids": ["P97", "P98", "P99", "P100", "P101", "P102", "P103", "E27", "NG28", "H97", "H98"],
  "objective": "Audit the proposed carry bound, normalized correction, same-Q geodesic criterion, local merge packing, and nonperiodic 250 dichotomy while preserving the periodic branch and the positive-ordinary-source obstruction.",
  "exact_scope": {
    "quantifiers": [
      "all finite coefficient-safe words for the symbolic carry and correction identities",
      "all least-positive-counterexample prefixes for ancestral/geodesic and local-merge implications",
      "all nonperiodic least-counterexample first-crossing prefixes for the residue-packing 250 dichotomy",
      "all coefficient-safe critical words through Q=17 for the finite layer audit",
      "the supplied Q=26 negative-carry pair and every mandatory adversarial family"
    ],
    "bounds": {"finite_maximum_q": 17, "contact_rich_percent": 43, "log_series_terms": 12, "adversarial_block_bound": 4},
    "completeness": "The theorem rows are exact derivations under their stated hypotheses. E27 is exhaustive only through Q=17; its contact-rich counts are diagnostics and are not an asymptotic input."
  },
  "arithmetic": {"proof_decisions": "exact", "floating_point_role": "none in acceptance; displayed decimal approximations are derived only after exact rational decisions"},
  "commands": {
    "generator": [".venv/bin/python src/phase16_search.py --artifact-dir artifacts --maximum-q 17"],
    "verifier": [".venv/bin/python verifier/verify_phase16.py --artifact-dir artifacts --output artifacts/phase16_verifier.json"],
    "tests": [".venv/bin/python -m pytest -q tests/test_phase16_properties.py tests/test_phase16_verifier.py tests/test_research_health.py", ".venv/bin/python -m pytest -q"]
  },
  "independence": {
    "verifier_reconstructs": ["the Q=26 affine pair from literal words", "all residue classes and exact logarithm enclosures", "every Q-layer word and same-Q endpoint minimum in a separate string-based enumeration", "every adversarial row and the periodic/nonperiodic status boundary"],
    "forbidden_imports": ["src.phase16_search", "phase16_search", "from src", "import src"],
    "tamper_tests": ["tests/test_phase16_verifier.py"]
  },
  "adversarial_families": ["2^m-1", "8^m-5", "(110|111)^*", "A=11101", "B=1100", "A^rB^s", "Phase 7 all-contact prefixes", "NG27 gain-four witness", "Q=26 negative carry"],
  "artifacts": ["artifacts/phase16_theory.json", "artifacts/phase16_finite_layers.json", "artifacts/phase16_adversarial.json", "artifacts/phase16_obstruction_report.md", "artifacts/phase16_verifier.json", "artifacts/SHA256SUMS"],
  "stop_conditions": ["Stop if the Q=26 pair is not literally safe or does not share its endpoint.", "Stop if any exact log enclosure has nonpositive margin.", "Do not apply distinct-orbit packing to a periodic prefix.", "Do not promote Q<=17 counts to an eventual theorem.", "Enter the proof-claim emergency protocol before changing proves_collatz."],
  "interpretation_boundary": ["G250 and H250 are a dichotomy, not exclusions.", "The q0 conclusion remains conditional on P54 and external X02.", "High contact plus geodesicity does not exclude the coherent all-contact 2-adic source.", "The periodic branch, H89, H72, and Collatz remain open.", "proves_collatz remains false."],
  "recorded_result": {
    "commit": "e313a13e8d85bf79925d5eedd33ca125e5fe619a",
    "generator": "completed at Q<=17 in 45.35s",
    "verifier": "valid=true at Q<=17 in 177.05s",
    "focused_tests": "16 passed in 5.19s",
    "full_tests": "258 passed in 318.81s",
    "strict_research_health": "valid=true with zero untracked artifacts",
    "manifest_sha256": "05f8bf81c23007386ca3b683eff300864f73319280ea4873962520f5c7a728e0",
    "verifier_valid": true
  },
  "proves_collatz": false
}
