{
  "schema_version": 1,
  "id": "phase35-full-decoder-joint-scalar",
  "status": "ACCEPTED",
  "claim_ids": ["P206", "P207", "P208", "P209", "P210", "E49", "E50", "NG41", "H89", "H133", "H172"],
  "objective": "Audit complete modular defect decoding and the simultaneous Phase 35 cycle inequalities without promoting the proposal's false area-238 scalar conclusion.",
  "exact_scope": {
    "quantifiers": [
      "every valid critical-safe word for the P206 theorem",
      "every valid reduced cycle profile for P207/P208",
      "every upper-convergent multiple under q<11500000000000 and d<=261 for P210",
      "every low-q scalar row 971<=q<=8191 at A<=228",
      "every critical-safe decoder word through q<=18 for E49"
    ],
    "bounds": {"cutoff": 11500000000000, "gcd_maximum": 261, "low_q_maximum": 8191, "decoder_q_maximum": 18},
    "completeness": "P206--P210 are exact lemmas/consequences; E49/E50 are bounded; NG41 refutes only the stated derivation. H89/H133/H172 and Collatz remain open."
  },
  "arithmetic": {
    "proof_decisions": "exact",
    "exact_methods": "arbitrary-precision integers, modular inverses and valuations, literal shortcut replay, rational logarithm enclosures, continued fractions, and integer scalar optimization",
    "floating_point_role": "none in acceptance"
  },
  "commands": {
    "generator": [".venv/bin/python src/phase35_search.py --artifact-dir artifacts"],
    "verifier": [".venv/bin/python verifier/verify_phase35.py --artifact-dir artifacts --output artifacts/phase35_verifier.json"],
    "tests": [".venv/bin/python -m pytest -q tests/test_phase35_properties.py tests/test_phase35_verifier.py tests/test_research_health.py", ".venv/bin/python -m pytest -q", ".venv/bin/python scripts/research_health.py --strict"]
  },
  "independence": {
    "verifier_reconstructs": ["all 1166058 source/profile/endpoint rows", "both low-q joint scalar audits and the proposal audit", "rational-log continued-fraction frontiers and exact cutoff arithmetic"],
    "forbidden_imports": ["src.phase35_search", "phase35_search", "from src", "import src"],
    "tamper_tests": ["tests/test_phase35_verifier.py"]
  },
  "adversarial_families": ["2^m-1", "8^m-5", "(110|111)^*", "A=11101", "B=1100", "A^rB^s", "source 167", "trivial cycle and powers", "negative cycles", "NG24-NG41"],
  "artifacts": ["artifacts/phase35_theory.json", "artifacts/phase35_decoder_audit.json", "artifacts/phase35_joint_scalar_audit.json", "artifacts/phase35_regressions.json", "artifacts/phase35_obstruction_report.md", "artifacts/phase35_verifier.json", "artifacts/SHA256SUMS"],
  "stop_conditions": ["Do not identify decoding with a smaller-ancestor theorem.", "Do not identify scalar feasibility with a realizable cycle.", "Do not claim A>=238 from the stated scalar sieve.", "Enter the proof-claim emergency protocol before changing proves_collatz."],
  "interpretation_boundary": ["The accepted critical area floor is A>=229.", "The first scalar obstruction is q=2301,A=229.", "The decoder leaves ordinary source dominance open."],
  "recorded_result": {
    "commit": "ecc2d048a64da6456c1753336c9885023b847950",
    "generator": "valid=true; 1166058 decoded words; 1912 corrected frontier candidates; 7221 low-q rows",
    "verifier": "valid=true; generator_imported=false; 1166058 decoded words; first scalar obstruction q=2301,A=229",
    "focused_tests": "14 passed in 265.16s",
    "full_tests": "480 passed in 2925.14s",
    "strict_research_health": "valid=true, errors=[], warnings=[]; 239 tracked artifacts",
    "manifest_sha256": "b8b285520a9422355fef710b5f0982acce5a82e5c1a5cd360adee01b9cfa0708",
    "verifier_valid": true
  },
  "proves_collatz": false
}
